{
  "format": "anwurf-goalkeeper",
  "version": 1,
  "matchId": 675700,
  "teamId": 86088,
  "opponentId": 86195,
  "isHome": true,
  "date": "2026-11-18",
  "startedAt": "2026-11-18T19:55:00.000Z",
  "exportedAt": "2026-11-18T21:40:00.000Z",
  "goalkeepers": [
    {
      "playerId": "1bt1pug",
      "name": "Laura Kähler",
      "number": 1
    },
    {
      "playerId": "0jotezw",
      "name": "Silja Paul",
      "number": 12
    }
  ],
  "events": [
    {
      "type": "goalkeeperChange",
      "half": 1,
      "second": 0,
      "goalkeeperId": "0jotezw",
      "at": "2026-11-18T20:00:00.000Z",
      "seq": 1
    },
    {
      "type": "shot",
      "half": 1,
      "second": 66,
      "goalkeeperId": "0jotezw",
      "zone": 1,
      "result": "save",
      "sevenMeter": false,
      "at": "2026-11-18T20:01:06.000Z",
      "seq": 2
    },
    {
      "type": "shot",
      "half": 1,
      "second": 159,
      "goalkeeperId": "0jotezw",
      "zone": 8,
      "result": "save",
      "sevenMeter": false,
      "at": "2026-11-18T20:02:39.000Z",
      "seq": 3
    },
    {
      "type": "shot",
      "half": 1,
      "second": 204,
      "goalkeeperId": "0jotezw",
      "zone": 5,
      "result": "save",
      "sevenMeter": false,
      "at": "2026-11-18T20:03:24.000Z",
      "seq": 4
    },
    {
      "type": "shot",
      "half": 1,
      "second": 294,
      "goalkeeperId": "0jotezw",
      "zone": 9,
      "result": "save",
      "sevenMeter": false,
      "at": "2026-11-18T20:04:54.000Z",
      "seq": 5
    },
    {
      "type": "shot",
      "half": 1,
      "second": 357,
      "goalkeeperId": "0jotezw",
      "zone": 0,
      "result": "miss",
      "sevenMeter": false,
      "at": "2026-11-18T20:05:57.000Z",
      "seq": 6
    },
    {
      "type": "shot",
      "half": 1,
      "second": 431,
      "goalkeeperId": "0jotezw",
      "zone": 0,
      "result": "miss",
      "sevenMeter": false,
      "at": "2026-11-18T20:07:11.000Z",
      "seq": 7
    },
    {
      "type": "shot",
      "half": 1,
      "second": 530,
      "goalkeeperId": "0jotezw",
      "zone": 0,
      "result": "miss",
      "sevenMeter": false,
      "at": "2026-11-18T20:08:50.000Z",
      "seq": 8
    },
    {
      "type": "shot",
      "half": 1,
      "second": 634,
      "goalkeeperId": "0jotezw",
      "zone": 0,
      "result": "miss",
      "sevenMeter": false,
      "at": "2026-11-18T20:10:34.000Z",
      "seq": 9
    },
    {
      "type": "shot",
      "half": 1,
      "second": 711,
      "goalkeeperId": "0jotezw",
      "zone": 5,
      "result": "save",
      "sevenMeter": false,
      "at": "2026-11-18T20:11:51.000Z",
      "seq": 10
    },
    {
      "type": "shot",
      "half": 1,
      "second": 801,
      "goalkeeperId": "0jotezw",
      "zone": 0,
      "result": "miss",
      "sevenMeter": false,
      "at": "2026-11-18T20:13:21.000Z",
      "seq": 11
    },
    {
      "type": "shot",
      "half": 1,
      "second": 883,
      "goalkeeperId": "0jotezw",
      "zone": 7,
      "result": "goal",
      "sevenMeter": false,
      "at": "2026-11-18T20:14:43.000Z",
      "seq": 12
    },
    {
      "type": "shot",
      "half": 1,
      "second": 947,
      "goalkeeperId": "0jotezw",
      "zone": 8,
      "result": "goal",
      "sevenMeter": false,
      "at": "2026-11-18T20:15:47.000Z",
      "seq": 13
    },
    {
      "type": "shot",
      "half": 1,
      "second": 1006,
      "goalkeeperId": "0jotezw",
      "zone": 4,
      "result": "goal",
      "sevenMeter": false,
      "at": "2026-11-18T20:16:46.000Z",
      "seq": 14
    },
    {
      "type": "shot",
      "half": 1,
      "second": 1111,
      "goalkeeperId": "0jotezw",
      "zone": 7,
      "result": "save",
      "sevenMeter": false,
      "at": "2026-11-18T20:18:31.000Z",
      "seq": 15
    },
    {
      "type": "shot",
      "half": 1,
      "second": 1186,
      "goalkeeperId": "0jotezw",
      "zone": 1,
      "result": "goal",
      "sevenMeter": false,
      "at": "2026-11-18T20:19:46.000Z",
      "seq": 16
    },
    {
      "type": "shot",
      "half": 1,
      "second": 1281,
      "goalkeeperId": "0jotezw",
      "zone": 0,
      "result": "miss",
      "sevenMeter": false,
      "at": "2026-11-18T20:21:21.000Z",
      "seq": 17
    },
    {
      "type": "shot",
      "half": 1,
      "second": 1350,
      "goalkeeperId": "0jotezw",
      "zone": 9,
      "result": "goal",
      "sevenMeter": false,
      "at": "2026-11-18T20:22:30.000Z",
      "seq": 18
    },
    {
      "type": "shot",
      "half": 1,
      "second": 1445,
      "goalkeeperId": "0jotezw",
      "zone": 8,
      "result": "save",
      "sevenMeter": false,
      "at": "2026-11-18T20:24:05.000Z",
      "seq": 19
    },
    {
      "type": "shot",
      "half": 1,
      "second": 1547,
      "goalkeeperId": "0jotezw",
      "zone": 0,
      "result": "miss",
      "sevenMeter": false,
      "at": "2026-11-18T20:25:47.000Z",
      "seq": 20
    },
    {
      "type": "shot",
      "half": 1,
      "second": 1597,
      "goalkeeperId": "0jotezw",
      "zone": 3,
      "result": "save",
      "sevenMeter": true,
      "at": "2026-11-18T20:26:37.000Z",
      "seq": 21
    },
    {
      "type": "shot",
      "half": 1,
      "second": 1660,
      "goalkeeperId": "0jotezw",
      "zone": 5,
      "result": "goal",
      "sevenMeter": false,
      "at": "2026-11-18T20:27:40.000Z",
      "seq": 22
    },
    {
      "type": "shot",
      "half": 1,
      "second": 1739,
      "goalkeeperId": "0jotezw",
      "zone": 0,
      "result": "miss",
      "sevenMeter": false,
      "at": "2026-11-18T20:28:59.000Z",
      "seq": 23
    },
    {
      "type": "goalkeeperChange",
      "half": 2,
      "second": 1800,
      "goalkeeperId": "0jotezw",
      "at": "2026-11-18T20:30:00.000Z",
      "seq": 24
    },
    {
      "type": "shot",
      "half": 2,
      "second": 1862,
      "goalkeeperId": "0jotezw",
      "zone": 0,
      "result": "miss",
      "sevenMeter": false,
      "at": "2026-11-18T20:31:02.000Z",
      "seq": 25
    },
    {
      "type": "shot",
      "half": 2,
      "second": 1950,
      "goalkeeperId": "0jotezw",
      "zone": 9,
      "result": "goal",
      "sevenMeter": false,
      "at": "2026-11-18T20:32:30.000Z",
      "seq": 26
    },
    {
      "type": "shot",
      "half": 2,
      "second": 2039,
      "goalkeeperId": "0jotezw",
      "zone": 0,
      "result": "miss",
      "sevenMeter": false,
      "at": "2026-11-18T20:33:59.000Z",
      "seq": 27
    },
    {
      "type": "shot",
      "half": 2,
      "second": 2101,
      "goalkeeperId": "0jotezw",
      "zone": 0,
      "result": "miss",
      "sevenMeter": false,
      "at": "2026-11-18T20:35:01.000Z",
      "seq": 28
    },
    {
      "type": "shot",
      "half": 2,
      "second": 2180,
      "goalkeeperId": "0jotezw",
      "zone": 9,
      "result": "goal",
      "sevenMeter": false,
      "at": "2026-11-18T20:36:20.000Z",
      "seq": 29
    },
    {
      "type": "shot",
      "half": 2,
      "second": 2285,
      "goalkeeperId": "0jotezw",
      "zone": 0,
      "result": "miss",
      "sevenMeter": false,
      "at": "2026-11-18T20:38:05.000Z",
      "seq": 30
    },
    {
      "type": "shot",
      "half": 2,
      "second": 2348,
      "goalkeeperId": "0jotezw",
      "zone": 9,
      "result": "goal",
      "sevenMeter": false,
      "at": "2026-11-18T20:39:08.000Z",
      "seq": 31
    },
    {
      "type": "shot",
      "half": 2,
      "second": 2445,
      "goalkeeperId": "0jotezw",
      "zone": 3,
      "result": "goal",
      "sevenMeter": false,
      "at": "2026-11-18T20:40:45.000Z",
      "seq": 32
    },
    {
      "type": "shot",
      "half": 2,
      "second": 2532,
      "goalkeeperId": "0jotezw",
      "zone": 1,
      "result": "goal",
      "sevenMeter": false,
      "at": "2026-11-18T20:42:12.000Z",
      "seq": 33
    },
    {
      "type": "shot",
      "half": 2,
      "second": 2606,
      "goalkeeperId": "0jotezw",
      "zone": 6,
      "result": "goal",
      "sevenMeter": false,
      "at": "2026-11-18T20:43:26.000Z",
      "seq": 34
    },
    {
      "type": "shot",
      "half": 2,
      "second": 2680,
      "goalkeeperId": "0jotezw",
      "zone": 5,
      "result": "goal",
      "sevenMeter": false,
      "at": "2026-11-18T20:44:40.000Z",
      "seq": 35
    },
    {
      "type": "goalkeeperChange",
      "half": 2,
      "second": 2700,
      "goalkeeperId": "1bt1pug",
      "at": "2026-11-18T20:45:00.000Z",
      "seq": 36
    },
    {
      "type": "shot",
      "half": 2,
      "second": 2751,
      "goalkeeperId": "1bt1pug",
      "zone": 9,
      "result": "goal",
      "sevenMeter": false,
      "at": "2026-11-18T20:45:51.000Z",
      "seq": 37
    },
    {
      "type": "shot",
      "half": 2,
      "second": 2857,
      "goalkeeperId": "1bt1pug",
      "zone": 4,
      "result": "save",
      "sevenMeter": false,
      "at": "2026-11-18T20:47:37.000Z",
      "seq": 38
    },
    {
      "type": "shot",
      "half": 2,
      "second": 2942,
      "goalkeeperId": "1bt1pug",
      "zone": 7,
      "result": "save",
      "sevenMeter": false,
      "at": "2026-11-18T20:49:02.000Z",
      "seq": 39
    },
    {
      "type": "shot",
      "half": 2,
      "second": 3028,
      "goalkeeperId": "1bt1pug",
      "zone": 2,
      "result": "save",
      "sevenMeter": false,
      "at": "2026-11-18T20:50:28.000Z",
      "seq": 40
    },
    {
      "type": "shot",
      "half": 2,
      "second": 3088,
      "goalkeeperId": "1bt1pug",
      "zone": 5,
      "result": "save",
      "sevenMeter": false,
      "at": "2026-11-18T20:51:28.000Z",
      "seq": 41
    },
    {
      "type": "shot",
      "half": 2,
      "second": 3142,
      "goalkeeperId": "1bt1pug",
      "zone": 5,
      "result": "save",
      "sevenMeter": false,
      "at": "2026-11-18T20:52:22.000Z",
      "seq": 42
    },
    {
      "type": "shot",